id,role,phase,region,topic,question_en,question_es,answer_en,answer_es,references,ref_types
"humanitarian-staff-032","humanitarian-staff","event","generic","data-information","How do I run a Multi-Sector Initial Rapid Assessment (MIRA) in the first 7-10 days?","¿Cómo conduzco una Evaluación Rápida Multisectorial (MIRA) en los primeros 7-10 días?","Convene a MIRA team led by OCHA + cluster focal points within 72h. Three pillars: secondary-data review (UMAIC + IDEAM + UNGRD EDAN drafts + media); community-level qualitative (focus groups in albergues and accessible communities, with sex/age/ethnic breakdown); key informant interviews (alcaldía, IPS, MoH, Defensoría). Outputs: severity ranking by municipality, immediate priority needs by cluster, access-and-coverage gap map. Mocoa 2017 lesson: rapid assessment must be iterative — figures changed daily for weeks. La Mojana lesson: cross JAC counts vs municipal censos to avoid duplication (Guaranda did this in 2024).","Convoque un equipo MIRA liderado por OCHA + puntos focales de clúster en 72h. Tres pilares: revisión de datos secundarios (UMAIC + IDEAM + EDAN preliminares de UNGRD + medios); cualitativo a nivel comunitario (grupos focales en albergues y comunidades accesibles, con desglose por sexo/edad/etnia); entrevistas a informantes clave (alcaldía, IPS, MinSalud, Defensoría). Productos: ranking de severidad por municipio, necesidades prioritarias inmediatas por clúster, mapa de brechas de acceso y cobertura. Lección Mocoa 2017: la evaluación rápida debe ser iterativa — las cifras cambiaron diariamente por semanas. Lección La Mojana: cruce conteos JAC con censos municipales para evitar duplicación (Guaranda lo hizo en 2024).","research/download-md/OCHA-La-Mojana-Factsheet-No1-19062025.md|research/humanitarian-aid-colombia/humanitarian-aid-context.md","local|local"
"humanitarian-staff-033","humanitarian-staff","event","generic","coordination","How do I keep a CMGRD-CDGRD-UNGRD information loop open from an ELC?","¿Cómo mantengo un bucle de información CMGRD-CDGRD-UNGRD abierto desde un ELC?","Anchor in the SNGRD architecture: CMGRD (municipal) → CDGRD (departmental) → UNGRD (national). At ELC level, the OCHA HoSO maintains daily contact with CDGRD director and weekly with UNGRD subdirección de manejo. Practical mechanisms: (i) jointly chair CDGRD reuniones extraordinarias when calamidad pública declared; (ii) feed UMAIC consolidations into UNGRD's national PMU; (iii) request EDAN packets from CMGRDs and reconcile with cluster figures; (iv) for La Mojana cross with Plan Mojana / Fondo Adaptación; (v) for Putumayo cross with ODGRD del Putumayo and Defensoría. Document any access denial or data refusal.","Apóyese en la arquitectura SNGRD: CMGRD (municipal) → CDGRD (departamental) → UNGRD (nacional). A nivel ELC, el HoSO de OCHA mantiene contacto diario con el director del CDGRD y semanal con la subdirección de manejo de UNGRD. Mecanismos prácticos: (i) co-presidir las reuniones extraordinarias del CDGRD cuando se declare calamidad pública; (ii) alimentar las consolidaciones UMAIC en el PMU nacional de la UNGRD; (iii) solicitar paquetes EDAN de los CMGRD y reconciliarlos con cifras de clúster; (iv) para La Mojana cruce con Plan Mojana / Fondo Adaptación; (v) para Putumayo cruce con ODGRD del Putumayo y Defensoría. Documente cualquier denegación de acceso o de datos.","research/download-md/OCHA-La-Mojana-Factsheet-No1-19062025.md|research/download-md/OCHA-Putumayo-Briefing-Departamental-2025.md","local|local"
"humanitarian-staff-034","humanitarian-staff","event","generic","data-information","How do I treat census data of affected households given protection risks?","¿Cómo trato los datos de censo de hogares afectados ante riesgos de protección?","Apply IASC Operational Guidance on Data Responsibility and EHP Colombia data-protection protocols: (i) collect minimum necessary PII; (ii) anonymize and aggregate before sharing across clusters; (iii) restrict raw beneficiary lists to a single repository per agency, encrypted; (iv) never share names of GBV survivors, indigenous leaders, ex-combatants; (v) in Putumayo and Catatumbo treat any beneficiary list as confidential due to NSAG taxation/coercion risk. Coordinate with the Information Management Working Group; the Cash Working Group has data-sharing modalities for FSPs.","Aplique la Guía Operacional del IASC sobre Responsabilidad de Datos y los protocolos de protección de datos del EHP Colombia: (i) recoja la mínima PII necesaria; (ii) anonimice y agregue antes de compartir entre clústeres; (iii) restrinja las listas crudas de beneficiarios a un repositorio único por agencia, cifrado; (iv) nunca comparta nombres de sobrevivientes VBG, líderes indígenas o ex-combatientes; (v) en Putumayo y Catatumbo trate cualquier lista de beneficiarios como confidencial por riesgo de tributación/coerción de GANE. Coordine con el Information Management Working Group; el Cash Working Group tiene modalidades de intercambio de datos con proveedores financieros.","research/humanitarian-aid-colombia/humanitarian-aid-context.md|research/download-md/OCHA-Putumayo-Briefing-Departamental-2025.md","local|local"
"humanitarian-staff-035","humanitarian-staff","event","generic","coordination","What does PSEA require from me at the start of a flood response?","¿Qué exige PSEA de mí al inicio de una respuesta a inundación?","Within 72h of cluster activation: (i) brief all responders on PSEA standards and the EHP Colombia PSEA Network; (ii) post complaints/reporting channels at every albergue (multi-channel: phone, anonymous box, focal point); (iii) verify all implementing partners signed PSEA codes of conduct; (iv) ensure Cash Working Group flows do not create coercion vectors; (v) GBV AoR and PSEA interlock — survivors of SEA are referred via GBV pathways, not investigated in public. Recipient agencies of CERF must report PSEA incidents to OCHA Geneva. Maintain a roster of Investigators per agency.","Dentro de 72h tras activación del clúster: (i) capacite a todos los respondientes en estándares PSEA y la Red PSEA del EHP Colombia; (ii) publique canales de quejas/reporte en cada albergue (multicanal: teléfono, buzón anónimo, punto focal); (iii) verifique que todos los socios implementadores firmaron códigos PSEA; (iv) asegure que los flujos del Cash Working Group no creen vectores de coerción; (v) la AoR VBG y PSEA están interconectadas — sobrevivientes de EAS se remiten vía rutas VBG, no se investigan en público. Las agencias receptoras CERF deben reportar incidentes PSEA a OCHA Ginebra. Mantenga un roster de Investigadores por agencia.","research/download-md/CERF-2022-La-Mojana-Rapid-Response.md|research/humanitarian-aid-colombia/humanitarian-aid-context.md","local|local"
"humanitarian-staff-036","humanitarian-staff","event","generic","disability-inclusion","How do I build disability inclusion into a flood response?","¿Cómo integro la inclusión de discapacidad en una respuesta a inundación?","Apply IASC Guidelines on Inclusion of Persons with Disabilities. Track PwD in beneficiary data — CERF 22-RR-COL-54690 reached only 485 PwD vs 1,145 planned, a known gap. Practical actions: (i) accessible WASH (CERF UNICEF action included accessibility-designed toilets); (ii) accessible communication (audio/visual/easy-read advisories); (iii) accessible registration in albergues; (iv) consult OPDs in Cash Working Group transfer-value setting; (v) ensure evacuation plans include people with mobility, hearing, vision, or cognitive impairments. Coordinate with Min Salud, ICBF, and OPD networks.","Aplique las Guías IASC sobre Inclusión de Personas con Discapacidad. Lleve a las PcD en los datos de beneficiarios — el CERF 22-RR-COL-54690 alcanzó solo 485 PcD frente a 1.145 planeadas, brecha conocida. Acciones prácticas: (i) WASH accesible (la acción CERF UNICEF incluyó letrinas con diseño accesible); (ii) comunicación accesible (audio/visual/lectura fácil); (iii) registro accesible en albergues; (iv) consulte OPD en la fijación de valores de transferencia del Cash Working Group; (v) asegure que los planes de evacuación incluyan personas con discapacidad motora, auditiva, visual o cognitiva. Coordine con MinSalud, ICBF y redes OPD.","research/download-md/CERF-2022-La-Mojana-Rapid-Response.md","local"
"humanitarian-staff-037","humanitarian-staff","event","generic","coordination","How do I prevent the donations bottleneck that paralyzed Mocoa 2017?","¿Cómo prevengo el cuello de botella de donaciones que paralizó Mocoa 2017?","Mocoa 2017 lesson: large in-kind donation flows arrived without classification, logistics or traceability and clogged distribution. Apply: (i) early Cash-First messaging to donors and the public via OCHA + UNGRD joint comms; (ii) coordinated public-donations channel (one-window) with Cruz Roja or local consortium; (iii) pre-agreed warehouse capacity (IFRC, IOM); (iv) categorize incoming goods on arrival, reject inappropriate items (used clothing, expired meds); (v) publish a needs-list updated weekly. Push the Cash Working Group to be visible to media and corporate donors from day 2.","Lección Mocoa 2017: grandes flujos de donaciones en especie llegaron sin clasificación, logística o trazabilidad y atascaron la distribución. Aplique: (i) mensajería Cash-First temprana a donantes y público vía comunicación conjunta OCHA + UNGRD; (ii) canal coordinado de donaciones públicas (ventanilla única) con Cruz Roja o consorcio local; (iii) capacidad de bodega preacordada (IFRC, OIM); (iv) categorice bienes entrantes al ingreso, rechace elementos inapropiados (ropa usada, medicamentos vencidos); (v) publique lista de necesidades actualizada semanalmente. Empuje al Cash Working Group a ser visible para medios y donantes corporativos desde el día 2.","research/download-md/ACAPS-2017-Mocoa-Floods-Mudslides.md|research/humanitarian-aid-colombia/humanitarian-aid-context.md","local|local"
"humanitarian-staff-038","humanitarian-staff","event","generic","coordination","How do I scale up local NGO partnerships during peak response?","¿Cómo escalo alianzas con ONG locales durante el pico de respuesta?","Locally Led Action is a Grand Bargain commitment. In Colombia: (i) prioritize national NGOs already in ELC (e.g., Pastoral Social, Corporación Paz y Democracia, Alianza de Mujeres Tejedoras de Vida, Corporación Casa Amazonía in Putumayo; Pastoral Social and local consortiums in La Mojana); (ii) sub-grant via UN agencies — CERF 22-RR-COL-54690 sub-granted US$466,804 to national NGOs; (iii) share Due Diligence harmonized formats; (iv) flexible reporting to compensate for capacity gaps; (v) allocate at least 25% of cluster activities to local actors per Grand Bargain.","La Locally Led Action es compromiso del Grand Bargain. En Colombia: (i) priorice ONGs nacionales ya en el ELC (p.ej., Pastoral Social, Corporación Paz y Democracia, Alianza de Mujeres Tejedoras de Vida, Corporación Casa Amazonía en Putumayo; Pastoral Social y consorcios locales en La Mojana); (ii) sub-otorgue vía agencias ONU — el CERF 22-RR-COL-54690 sub-otorgó US$466.804 a ONGs nacionales; (iii) comparta formatos de Due Diligence armonizados; (iv) reporte flexible para compensar brechas de capacidad; (v) destine al menos 25% de actividades de clúster a actores locales según Grand Bargain.","research/download-md/CERF-2022-La-Mojana-Rapid-Response.md|research/download-md/OCHA-Putumayo-Briefing-Departamental-2025.md","local|local"
"humanitarian-staff-039","humanitarian-staff","event","generic","coordination","Should I trigger a Charter of the International Disasters Charter / Copernicus EMS activation?","¿Debo activar la Carta Internacional de Desastres / Copernicus EMS?","Yes when (i) flood extent exceeds national Copernicus/UNGRD response mapping capacity, or (ii) NSO data is not timely. Colombia precedents: EMSR865 (Córdoba Feb 2026 flood, Copernicus EMS Rapid Mapping); UNOSAT product 4022 (La Mojana Nov 2024); Charter activated Nov 2024 for La Mojana / Caribbean coast. Activation is by the National Authorized User (UNGRD or Cancillería). Coordinate via OCHA Information Management Officer with UNOSAT or Copernicus EMS — they require named focal point and exposure-of-interest polygons. Outputs feed UMAIC products.","Sí cuando (i) la extensión de inundación supera la capacidad nacional de mapeo Copernicus/UNGRD, o (ii) los datos del INE no son oportunos. Precedentes Colombia: EMSR865 (inundación Córdoba feb 2026, Copernicus EMS Rapid Mapping); producto UNOSAT 4022 (La Mojana nov 2024); Carta activada nov 2024 para La Mojana / costa Caribe. La activación la hace el Usuario Nacional Autorizado (UNGRD o Cancillería). Coordine vía el Information Management Officer de OCHA con UNOSAT o Copernicus EMS — requieren punto focal nombrado y polígonos de exposición. Los productos alimentan a UMAIC.","research/water-crisis-colombia.md|https://emergency.copernicus.eu/mapping/list-of-components/EMSR865","local|cloud"
"humanitarian-staff-040","humanitarian-staff","event","la-mojana","early-recovery","When do I activate the Early Recovery Cluster in chronic La Mojana flooding?","¿Cuándo activo el clúster de Recuperación Temprana en la inundación crónica de La Mojana?","UNDP leads Early Recovery (RT). Because La Mojana is chronic — never fully recedes between cycles — activate RT in parallel with response from week 4-6, not after. Priorities: (i) livelihoods diversification (agroecology pilot per La Mojana 2024 ACAPS findings); (ii) infrastructure micro-recovery (community jarillones, footbridges, fluvial transport); (iii) institutional strengthening of CMGRDs; (iv) wetland-based DRR linked to UNDP-GCF Adaptation Fund 'Reducing Risk and Vulnerability...Depresión Momposina' project; (v) link to Plan Mojana works through Fondo Adaptación. CPRP intervention type 4 (peace-development articulation) is the natural home.","PNUD lidera Recuperación Temprana (RT). Como La Mojana es crónica — nunca se seca por completo entre ciclos — active RT en paralelo a la respuesta desde la semana 4-6, no después. Prioridades: (i) diversificación de medios de vida (piloto agroecológico según ACAPS La Mojana 2024); (ii) micro-recuperación de infraestructura (jarillones comunitarios, pasarelas, transporte fluvial); (iii) fortalecimiento institucional de los CMGRD; (iv) RRD basada en humedales conectada al proyecto PNUD-FVC Fondo de Adaptación 'Reducing Risk and Vulnerability...Depresión Momposina'; (v) vinculación con obras del Plan Mojana vía Fondo Adaptación. La intervención tipo 4 del CPRP (articulación paz-desarrollo) es el hogar natural.","research/download-md/ACAPS-2024-La-Mojana-Flooding.md|research/download-md/IISD-Restoring-Wetlands-La-Mojana.md|research/water-crisis-colombia.md","local|local|local"
"humanitarian-staff-041","humanitarian-staff","event","generic","coordination","How do I keep media engagement aligned with humanitarian principles during a high-profile flood?","¿Cómo mantengo la relación con medios alineada a los principios humanitarios en una inundación de alto perfil?","Coordinate via OCHA Communications + agency PIOs in a single talking-points sheet. Rules: (i) no images/names of children, GBV survivors, indigenous leaders without informed consent; (ii) accurate aggregate figures sourced to UNGRD/UMAIC, not speculative; (iii) avoid politicization (don't frame UNGRD as failed even when access is poor — use 'gaps'); (iv) credit affected communities and local responders; (v) for La Mojana frame chronic-crisis, for Putumayo frame double-impact (climate + conflict). Use radio for community-facing messages — La Mojana lessons noted radio comunitaria as primary channel for evacuation and aid info.","Coordine vía Comunicaciones OCHA + PIO de agencias en una hoja única de mensajes. Reglas: (i) sin imágenes/nombres de niñez, sobrevivientes VBG, líderes indígenas sin consentimiento informado; (ii) cifras agregadas precisas con fuente UNGRD/UMAIC, no especulativas; (iii) evite politizar (no presentar a UNGRD como fallida aunque el acceso sea deficiente — use 'brechas'); (iv) reconozca a comunidades afectadas y respondientes locales; (v) para La Mojana enmarque la crisis crónica, para Putumayo enmarque el doble impacto (clima + conflicto). Use la radio para mensajes a la comunidad — lecciones La Mojana destacan la radio comunitaria como canal primario para evacuación e información de ayuda.","research/download-md/OCHA-La-Mojana-Factsheet-No1-19062025.md|research/humanitarian-aid-colombia/humanitarian-aid-context.md","local|local"
"humanitarian-staff-042","humanitarian-staff","event","generic","disability-inclusion","How does Sphere apply to my albergue site management?","¿Cómo se aplica Sphere a la gestión del sitio del albergue?","Sphere Minimum Standards (latest 2018) are the operational reference: water (15L/person/day minimum, recommended 20L+), sanitation (1 latrine per 20 persons, sex-separated), hygiene (handwashing per 250 ppl), shelter (3.5m² covered space per person), health (consultations <50/day per clinician). For Colombia adapt to ENS / Min Vivienda standards. La Mojana shows recurrent shortfalls — Alto San Matías (Guaranda) had no aqueduct or sewerage even hosting 210+ displaced. Conduct daily WASH-shelter walks; quarterly Sphere self-assessments.","Las Normas Mínimas Sphere (2018) son la referencia operacional: agua (15 L/persona/día mínimo, recomendado 20+); saneamiento (1 letrina por 20 personas, separado por sexo); higiene (lavamanos por 250 personas); albergue (3,5 m² techados por persona); salud (consultas <50/día por clínico). Para Colombia adapte a estándares ENS / MinVivienda. La Mojana muestra carencias recurrentes — Alto San Matías (Guaranda) no tenía acueducto ni alcantarillado incluso albergando 210+ desplazados. Realice rondas WASH-albergue diarias; auto-evaluaciones Sphere trimestrales.","research/download-md/OCHA-La-Mojana-Factsheet-No1-19062025.md|https://spherestandards.org/","local|cloud"
"humanitarian-staff-043","humanitarian-staff","event","generic","coordination","How do I integrate the Unidad para las Víctimas AHI when floods overlap conflict displacement?","¿Cómo integro la AHI de la Unidad para las Víctimas cuando las inundaciones se superponen con desplazamiento por conflicto?","AHI (Atención y Ayuda Humanitaria Inmediata) is the Unidad's instrument for Law-1448 victims; municipios are first responders. When flooding compounds conflict displacement (Putumayo, Catatumbo, Pacífico), populations may be eligible under both AHI (conflict criteria) and UNGRD-led disaster response. Operational deconfliction: ELC verifies each affected family's victim status; UN agencies do not duplicate AHI components (alimentación, kits aseo, cocina, alojamiento transitorio) but complement (specialized child protection, GBV, MHPSS, livelihoods). Recommend Comité Extraordinario de Justicia Transicional for masivos.","La AHI (Atención y Ayuda Humanitaria Inmediata) es el instrumento de la Unidad para víctimas Ley 1448; los municipios son primeros respondientes. Cuando la inundación se superpone con desplazamiento por conflicto (Putumayo, Catatumbo, Pacífico) las personas pueden ser elegibles tanto por AHI (criterio conflicto) como por respuesta a desastres liderada por UNGRD. Desconflicto operacional: el ELC verifica el estatus víctimas de cada familia; las agencias ONU no duplican componentes AHI (alimentación, kits aseo, cocina, alojamiento transitorio) sino que complementan (protección de niñez especializada, VBG, SMAPS, medios de vida). Recomiende Comité Extraordinario de Justicia Transicional para eventos masivos.","research/humanitarian-aid-colombia/humanitarian-aid-context.md","local"
"humanitarian-staff-044","humanitarian-staff","post","generic","coordination","When and how do I run an After-Action Review (AAR) for a flood response?","¿Cuándo y cómo conduzco un After-Action Review (AAR) por una respuesta a inundación?","CERF requires AAR within 6 months of project end (CERF 22-RR-COL-54690 AAR was on 11 May 2023 with OCHA, WFP, PAHO, UNICEF). Run an inter-agency AAR per cluster after 4-6 months of acute response. Method: (i) facilitator-led half-day session with HCT and clusters; (ii) review what worked, what failed, what gaps remained; (iii) document lessons in shared minutes; (iv) feed into next CPRP cycle and next contingency-plan revision. Always include local NGOs and at least one community delegation. Confirm final report shared with implementing partners and government counterparts.","CERF exige AAR dentro de 6 meses tras fin del proyecto (el AAR del CERF 22-RR-COL-54690 fue el 11 de mayo de 2023 con OCHA, PMA, OPS, UNICEF). Conduzca un AAR interagencial por clúster a los 4-6 meses de respuesta aguda. Método: (i) sesión de medio día facilitada con HCT y clústeres; (ii) revise qué funcionó, qué falló, qué brechas quedaron; (iii) documente lecciones en actas compartidas; (iv) alimente el siguiente ciclo CPRP y la próxima revisión del plan de contingencia. Incluya siempre ONGs locales y al menos una delegación comunitaria. Confirme que el informe final se comparte con socios implementadores y contrapartes gubernamentales.","research/download-md/CERF-2022-La-Mojana-Rapid-Response.md","local"
"humanitarian-staff-045","humanitarian-staff","post","generic","coordination","What does Post-Distribution Monitoring (PDM) require per cluster?","¿Qué exige el Monitoreo Post-Distribución (PDM) por clúster?","PDM is mandatory per cluster post-distribution. Sample size: ~10% of beneficiaries or per Sphere/MEAL guidance. Tools: digital surveys (Kobo, ODK) with disaggregated questions (sex, age, ethnic, PwD, conflict-displacement status). Cluster-specific indicators: WASH — water consumption per person/day, hygiene-kit utility, satisfaction with chlorination; FSL — food consumption score, dietary diversity, market function; Health — service-access, MHPSS reach; Protection — feedback on safety, complaints handled; Shelter — habitability, sex-separation, complaints. Aggregate at ELC level; feed CPRP reporting and next-cycle planning.","El PDM es obligatorio por clúster post-distribución. Muestra: ~10% de beneficiarios o según guía Sphere/MEAL. Herramientas: encuestas digitales (Kobo, ODK) con preguntas desagregadas (sexo, edad, etnia, PcD, estatus víctimas de conflicto). Indicadores por clúster: WASH — consumo de agua por persona/día, utilidad del kit, satisfacción con cloración; SAN — puntaje de consumo de alimentos, diversidad dietética, función de mercados; Salud — acceso al servicio, alcance SMAPS; Protección — retroalimentación sobre seguridad, quejas atendidas; Albergue — habitabilidad, separación por sexo, quejas. Agregue a nivel ELC; alimente el reporte CPRP y la planificación del siguiente ciclo.","research/humanitarian-aid-colombia/humanitarian-aid-context.md","local"
"humanitarian-staff-046","humanitarian-staff","post","la-mojana","recovery","How do I plan a transition from emergency to recovery in protracted La Mojana?","¿Cómo planifico la transición de emergencia a recuperación en La Mojana prolongada?","La Mojana is chronic — 4+ years since the 27 August 2021 Cara de Gato breach with multiple re-pulses (2022, 2024, 2025). 'Transition' is a misnomer; plan parallel emergency + recovery from year 1. Apply CPRP intervention types 3 (anticipatory action) and 4 (peace-development articulation). Concretely: (i) UNDP-led ER cluster handover plan; (ii) link to Plan Mojana / Fondo Adaptación infrastructure works (Canal de la Esperanza, dike rebuilds); (iii) IISD wetland-restoration recommendations as DRR core; (iv) UNDP-GCF Adaptation Fund project as long-term anchor; (v) Alianza Común La Mojana (300+ JACs convened in Sincelejito/Majagual) as community interlocutor.","La Mojana es crónica — 4+ años desde la ruptura del 27 ago 2021 en Cara de Gato con múltiples re-pulsos (2022, 2024, 2025). 'Transición' es un nombre erróneo; planifique emergencia + recuperación en paralelo desde el año 1. Aplique intervenciones tipo 3 (acción anticipatoria) y 4 (articulación paz-desarrollo) del CPRP. Concretamente: (i) plan de entrega del clúster RT liderado por PNUD; (ii) articulación con obras Plan Mojana / Fondo Adaptación (Canal de la Esperanza, reconstrucción de diques); (iii) recomendaciones IISD de restauración de humedales como núcleo de RRD; (iv) proyecto Fondo de Adaptación PNUD-FVC como ancla de largo plazo; (v) Alianza Común La Mojana (300+ JACs convocadas en Sincelejito/Majagual) como interlocutor comunitario.","research/download-md/IISD-Restoring-Wetlands-La-Mojana.md|research/download-md/OCHA-La-Mojana-Factsheet-No1-19062025.md|research/water-crisis-colombia.md","local|local|local"
